Republic of the Philippines,,,,,,,,,,,,,,
Province of South Cotabato,,,,,,,,,,,,,,
OFFICE OF THE PROVINCIAL ENGINEER,,,,,,,,,,,,,,
City of Koronadal,,,,,,,,,,,,,,
,,,,,,,,,,,,,,
SUMMARY OF MONTHLY ACCOMPLISHMENT REPORTS,,,,,,,,,,,,,,
"As of December 25, 2018",,,,,,,,,,,,,,
,,,,,,,,,,,,,,
,Name of Project,Location,Source of Funds,Accomplishment,,Slippage,Contract,No. of Days,Date,Target Date of Completion,Date Completed,Project Engineer,Implementor,Remarks
,,,, % WT Actual,% WT Plan,,Amount,,Started,,,,,
1,"Construction of Sports Learning center, Brgy. Glamang",Polomolok,SEF SB #1-999-CONSTRUCTION OF SCHOOL BLDGS. & OTHER FACILITIES,0.07%,0.07%,," 3,174,945.71 ",130,12/20/18,4/28/19,,J JANUTO,MFN BUILDERS,On-going
2,"Completion of Sports Learning center, Brgy. Sumbakil E/S",Polomolok,SEF SB #1-999-CONSTRUCTION OF SCHOOL BLDGS. & OTHER FACILITIES,1.08%,1.44%,-0.36%," 994,602.93 ",90,12/16/18,3/15/19,,J JANUTO,ROCKSTONE CONSTRUCTION SERVICES & SUPPLY,On-going
3,"Completion of Sports Learning center @ Kalyong E/S, Brgy. Landan",Polomolok,SEF SB #1-999-CONSTRUCTION OF SCHOOL BLDGS. & OTHER FACILITIES,1.76%,3.75%,-1.99%," 996,872.98 ",90,12/12/18,3/11/19,,J JANUTO,THREE G BUILDERS,On-going
4,"Construction of Gabion/Dike, Brgy. Klinan 6",Polomolok,SEF SB #1-999-CONSTRUCTION OF SCHOOL BLDGS. & OTHER FACILITIES,0.09%,2.60%,-2.51%," 5,353,075.72 ",72,12/16/18,2/25/19,,J JANUTO,ROCKSTONE CONSTRUCTION SERVICES & SUPPLY,On-going
5,"Construction of Sports Learning center, Brgy. Polonoling NHS",Tupi,SEF SB #1-999-CONSTRUCTION OF SCHOOL BLDGS. & OTHER FACILITIES,0.14%,1.08%,-0.94%," 3,190,253.56 ",130,12/11/18,4/19/19,,J JANUTO,CRISNARD CONST. & SUPPLY,On-going
6,Const. of Box Culvert @ Prk. Malipayon,Tupi,CY 2017 CONT APPROP. #24,49.88%,52.42%,-2.54%," 1,935,054.16 ",90,11/5/17,1/14/19,,J JANUTO,KING BUILDERS CONST. & SUPPLY,On-going; time extension is on process
7,Upgrading of Acmonan Road,Tupi,CY 2018 20% LDF 4.2.12,93.86%,96.66%,-2.80%," 9,968,842.72 ",135,7/23/18,1/3/19,,J JANUTO,PASE CONSTRUCTION,On-going
8,Const. of 2CL School Bldg. w/ Two Seater Attached Toilet @ Ricardo D. Avila Elementary School,Tupi,2018 CONT. APPRO GF #41,7.11%,23.18%,-16.07%," 1,979,900.18 ",120,10/2/18,1/29/19,,J JANUTO,ILON MULTIBUILDERS CO.,On-going; Major Issue: lack of materials and skilled laborers
9,"Construciton of One (1) Unit Coffee trading Center, Brgy. Poblacion",Tupi,PRDP,17.62%,20.10%,-2.48%," 2,395,072.06 ",90,11/3/18,1/31/19,,J JANUTO,ROCKSTONE CONST. SERVICES & SUPPLY,On-going
10,Construciton of Signages/Wayfinders in key Tourist destination/Information Warning Devices,Tupi,2018 CONT. APPRO GF #65,0.00%,0.24%,-0.24%," 1,784,823.30 ",120,11/21/18,3/19/19,,J JANUTO,PASE CONSTRUCTION,"Suspended as of Dec. 5, 2018 due to conflict on the project site"
11,"Const. of one (1) Unit Warehouse and Drier @ Brgy. Kinilis, Polomolok & Brgy. Poblacion, Tampakan",Polomolok & Tampakan,PRDP,31.38%,40.28%,-8.90%," 2,994,969.77 ",90,11/3/18,1/31/19,,J JANUTO,ROCKSTONE CONST. SERVICES & SUPPLY,On-going
12,"Construction of Bleacher, Brgy. Koronadal Proper",Tupi,CY 2018 20% LDF,1.46%,1.45%,0.01%," 993,780.55 ",60,12/16/18,3/15/19,,J JANUTO,ROCKSTONE CONST. SERVICES & SUPPLY,On-going
13,Construction of Sitio El Nama Bridge,Tupi,CY 2016 CONT APPROP. #182-GF,97.00%,100.00%,-3.00%," 4,904,647.08 ",220,6/12/16,1/17/17,,A. DEMETILLO,CS CONSTRUCTION & SUPPLY,On-going
14,"Construction of Covered Court, Brgy. Pula Bato",Tampakan,2018 CONT. APPRO GF #304,47.96%,74.35%,-26.39%," 4,066,740.44 ",180,9/4/18,3/2/19,,A DEMETILLO,ILON MULTIBUILDERS CO.,On-going
15,"Construciton of Lined Canal @ Godmaling, Prk, Quezon, Brgy. Sta. Cruz",Tampakan,2018 NON-OFFICE PDRRMF 3.A.10,26.96%,14.55%,12.41%," 5,336,492.32 ",240,10/10/18,6/6/19,,A DEMETILLO,PASE CONSTRUCTION,On-going
16,Rehabilitation of Albagan Road,Tampakan,,89.33%,100.00%,-10.67%," 5,986,721.47 ",100,9/26/17,9/18/18,,A BARRIENTOS,JAMI CONST. & SUPPLY,On-going; due for LD
17,Const. of Albagan Gym with Stage,Tampakan,CY 2017 20% LDF,90.64%,100.00%,-9.36%," 4,033,389.66 ",200,11/28/17,6/15/18,,A BARRIENTOS,JAMI CONST. & SUPPLY,On-going; due for LD
18,"Const. of Salway Box Culvert, Brgy. Tablu",Tampakan,9999-Non-Office 5% CF,60.78%,100.00%,-39.22%," 2,987,473.44 ",135,12/26/17,10/17/18,,A BARRIENTOS,MFN BUILDERS,On-going
19,Completion of Sport Learning Center @ Kipalbig E/S,Tampakan,SEF SB #1-999-CONSTRUCTION OF SCHOOL BLDGS. & OTHER FACILITIES,4.67%,17.65%,-12.98%," 995,550.59 ",90,12/10/18,3/9/19,,A BARRIENTOS,ILON MULTIBUILDERS CO.,On-going
20,Construction of 2nd Floor of the Student Dormitory,Koronadal City,CY 2018 Cont. APPROP. GF #211,100.00%,100.00%,0.00%," 2,989,399.99 ",90,3/27/18,8/18/18,12/1/18,S RENTOZA,MARBEL DYNAMIC BUILDERS,Completed
21,Upgrading of San Jose-Columbio Bdry. Road,Koronadal City,CY 2018 20% LDF,77.93%,72.14%,5.79%," 9,988,025.62 ",130,9/23/18,1/30/19,,S RENTOZA,GABRIELLAS ENTERPRISES,On-going
22,Alteration & Renovation of Extg. Wooden Spectator's Stand and Control Tower @ SCSC (Control Tower),Koronadal City,CY 2018 Cont. APPROP. GF #105,48.74%,61.61%,-12.87%," 5,427,551.51 ",150,9/6/18,2/3/19,,S RENTOZA,GABRIELLAS ENTERPRISES,On-going
23,Construction of Water System @ Brgy. Carpenter Hill,Koronadal City,CY 2018 20% LDF 4.4.1,34.33%,17.69%,16.64%," 4,911,276.54 ",226,9/23/18,5/6/19,,S RENTOZA,DUMALAG SURVEYING & ENG'E. SERVICES,On-going
24,Proposed Renovation of Provincial Capitol Roofing System ,Koronadal City,CY 2018 20% LDF,23.36%,22.94%,0.42%," 3,492,415.22 ",90,11/28/18,2/25/19,,S RENTOZA,FH GOPITEO CONSTRUCTION & SUPPLY,On-going
25,"Const. of Bukang Liwayway Bridge/Riverbank Protection, Prk. Artesian, Brgy. San Roque ",Koronadal City,CY 2016 20% LDF,83.84%,93.86%,-10.02%," 15,950,503.14 ",320,12/5/16,9/4/18,,E SOLATORIO,REYDAN BUILDERS,On-going; Suspended due to lacking of items for the installation of steel bridge
26,"Const. of 1 Unit Box Culvert Connecting Prk. Pag-asa & Prk. Blaan, Brgy. Magsaysay",Koronadal City,2017 PDRRMF-IP TF 2.4,92.49%,100.00%,-7.51%," 1,263,126.92 ",90,4/16/18,10/27/18,,E SOLATORIO,KING BUILDERS CONST. & SUPPLY,On-going
27,Completion of PDRR Operations Center & Warehouse @ PEO Compound,Koronadal City,999.4-SB#2-CPDRROCW,54.10%,82.24%,-28.14%," 1,488,317.54 ",70,4/8/18,6/16/18,,E SOLATORIO,ROCKSTONE CONST. SERVICES & SUPPLY,"Suspended as of June 14, 2018 due to the new policy of SOCOTECO 1 in banking of 100kVA transformer"
28,Upgrading of Cacub to Palo 19 Road,Koronadal-Tampakan,CY 2016CONT. APPROP. #194-GF,91.07%,100.00%,-8.93%," 9,769,932.04 ",180,7/26/16,5/21/18,,E SOLATORIO,KING BUILDERS CONST. & SUPPLY,On-going
29,"Construction of provincial Head Quarter's Building, Brgy. Morales",Koronadal City,CY 2018 CONT. APPROP. #115-GF,60.41%,70.05%,-9.64%," 3,995,647.57 ",135,9/23/18,2/4/19,,E SOLATORIO,FH GOPITEO CONSTRUCTION & SUPPLY,On-going
30,KNCHS Senior HS Faculty Room Renovation,Koronadal City,CY 2018 CONT. APPROP. #151-GF,0.00%,,," 897,272.09 ",75,10/25/18,1/7/19,,E SOLATORIO,FH GOPITEO CONSTRUCTION & SUPPLY,"Suspended as of October 25, 2018 due to variation order & approved revised plan"
31,Construciton of Anatomy Laboratory for Medical Program at UP Campus,Koronadal City,CY 2018 CONT. APPRO GF #210,8.72%,13.70%,-4.98%," 1,491,968.43 ",60,11/21/18,1/19/19,,E SOLATORIO,PASE CONSTRUCTION,Suspension order is on process
32,"Construction of CIDG Building, Brgy. Morales",Koronadal City,CY 2018 CONT. APPROP. GF#149,,,," 2,482,183.81 ",90,11/27/18,2/24/19,,E SOLATORIO,MIGO CONSTRUCITON,Suspended due to revision of plan & variation order
33,"Construction of Day Care Center, Brgy. Dumadalig",Tantangan,2018 CONT. APPRO SEF #46,6.54%,9.20%,-2.66%," 1,389,437.49 ",90,11/21/18,2/18/19,,S RENTOZA,JANMARIE CONST. SERVICE & SUPPLY,On-going
34,"Installation of Power and Water System @ IPEMC, Brgy. Tinongcop",Tantangan,2018 20% LDF 5.2.2,81.81%,100.00%,-18.19%," 397,522.86 ",50,11/4/18,12/23/18,,S RENTOZA,THREE G BUILDERS,On-going
35,"Construction of Multipurpose Building, Brgy. Poblacion",Tantangan,2018 20% LDF ,0.35%,2.77%,-2.42%," 3,085,788.47 ",120,12/9/18,4/7/19,,S RENTOZA,MIGO CONSTRUCITON,On-going
36,"Repair of Senior Citizen Building & Construciton of Covered Area with Stage, Brgy. Rang-ay",Banga,CY 2018 CONT. APPROP. GF# 256 & 58,81.21%,37.13%,44.08%," 1,492,117.32 ",125,9/5/18,1/7/19,,MJ Dauz,FH GOPITEO CONSTRUCTION & SUPPLY,On-going
37,"Const. of Multi Purpose Building (Barangay Hall), Brgy. Punong Grande",Banga,CY 2018 20% LDF,19.94%,21.50%,-1.56%," 3,191,578.09 ",120,11/14/18,3/13/19,,MJ Dauz,C.A. BETALAC CONST. & GEN. MDSE.,On-going
38,"Labor for the Completion of Water-Irrigation System @ provincial Scion Grove, Nursery, Research and Demo Farm",Banga,2018 CONT. APPRO GF 3 139,80.00%,,," 126,000.00 ",45,11/14/18,12/28/18,,MJ Dauz,C.A. BETALAC CONST. & GEN. MDSE.,"Suspended as of Dec. 21, 2018 due to insufficient materials provided for construction of pump house"
39,"Establishment of Food Processing & Demontration Area @ provincial Scion Grove, Nursery, Research & Demo Farm",Banga,2018 20% LDF ,2.31%,2.35%,-0.04%," 1,447,878.28 ",95,11/27/18,3/1/19,,MJ Dauz,FH GOPITEO CONST. & SUPPLY,On-going
40,"Construction of Three CL (7x9) Building with Attached Toilet, Rang-ay Integrated School",Banga,SEF SB #1-999-CONSTRUCTION OF SCHOOL BLDGS. & OTHER FACILITIES,0.00%,0.49%,-0.49%," 2,995,385.13 ",150,12/20/18,5/18/19,,MJ Dauz,FH GOPITEO CONST. & SUPPLY,On-going
41,Construction of Sports Learning Center @ Lamba NHS (Matlong Campus),Banga,SEF SB #1-999-CONSTRUCTION OF SCHOOL BLDGS. & OTHER FACILITIES,6.68%,0.51%,6.17%," 3,095,811.60 ",130,12/10/18,4/18/19,,MJ Dauz,C.A. BETALAC CONST. & GEN. MDSE.,On-going
42,"Spring Dev't. & Inst. Of Level II Water System through Hydraulic Rampump, Brgy. San Vicente",Banga,CY 2017 20% LDF,61.59%,91.06%,-29.47%," 2,700,099.48 ",175,5/21/18,11/11/18,,ME Dondiego,DAVAO SANTHONY BUILDERS CORP.,"Suspended as of October 30, 2018 due to Variation order"
43,Upgrading of Yangco-Rang-ay Road,Banga,CY 2018 20% LDF,100.00%,100.00%,0.00%," 10,985,324.48 ",165,7/4/18,12/15/18,12/15/18,ME Dondiego,FH GOPITEO CONST. & SUPPLY,Completed
44,"Completion of Barangay Hall, Brgy. Rizal, Poblacion",Banga,CY 2018 CONT. APPRO. GF #123,17.89%,15.37%,2.52%," 893,970.00 ",60,10/25/18,1/17/19,,CJ HICBAN,NIRVANA CONST. & SUPPLIES,"Resuemd as of December 10, 2018"
45,Completion of Sports Learning Center @ El Nonok integrated School,Banga,SEF SB #1-999-CONSTRUCTION OF SCHOOL BLDGS. & OTHER FACILITIES,3.67%,6.24%,-2.57%," 997,315.63 ",90,12/12/18,3/11/19,,CJ HICBAN,THREE G BUILDERS,On-going
46,Const. of Riverbank Protection (Indigenous Materials) & Rechanelling of Waterway @ Brgy. San Miguel,Norala,SEF-212-11.1a,2.96%,71.90%,-68.94%," 2,692,684.72 ",60,11/1/16,12/1/18,,CJ HICBAN,ROCKSTONE CONST. SERVICES & SUPPLY,"Suspended as of Nov. 28, 2018 due to scarcity of bamboos & request of landowner to resurvey the project site"
47,Conc. Of Provincial Road Lapus to Brgy. Liberty,Norala,CY 2018 CONT. APPROP. GF #75,6.80%,11.17%,-4.37%," 17,240,000.00 ",125,3/29/18,7/31/18,,CJ HICBAN,FREDEN CONSTRUCTION,"Project suspended as of April 25, 2018 due to road right of way problem"
48,Rehabilitation of NDH Water System,Norala,CY 2017 20% LDF,74.06%,100.00%,-25.94%," 375,786.23 ",40,12/21/17,9/14/18,,A SOBREVEGA,ROCKSTONE CONST. SERVICES & SUPPLY,"On-going; variation order, final quantification of quantities & time extension is on process"
49,Rehabilitation of Puti Water System,Norala,CY 2018 CONT. APPROP. GF #,100.00%,100.00%,0.00%," 1,962,026.71 ",145,4/8/18,8/30/18,12/17/18,A SOBREVEGA,ROCKSTONE CONST. SERVICES & SUPPLY,Completed
50,Upgrading of Jct. provincial Road-Lopez Jaena to Brgy. Katipunan,Norala & Sto. Niño,CY 2018 20% LDF #4.2.14,81.50%,29.33%,52.17%," 9,988,834.34 ",162,9/6/18,2/14/19,,A SOBREVEGA,FREDEN CONSTRUCTION,On-going
51,Upgrading of jct. Nhwy. Panay-San Vicente-Guinsang-an Road,Sto. Niño,2018 20% LDF,13.79%,5.58%,8.21%," 14,976,633.83 ",165,11/14/18,4/27/18,,MJ Dauz,FH GOPITEO CONST. & SUPPLY,On-going
52,"Construction of Day Care Center, Brgy. M. Roxas",Sto. Niño,CY 2018 Cont. Appro SEF #44,43.27%,28.60%,14.67%," 1,391,639.27 ",90,11/21/18,2/18/19,,ME Dondiego,FH GOPITEO CONST. & SUPPLY,On-going
53,Completion of Sports Learning Center @ Sto. Niño CES,Sto. Niño,SEF SB #1-999-CONSTRUCTION OF SCHOOL BLDGS. & OTHER FACILITIES,0.00%,0.51%,-0.51%," 4,070,985.86 ",165,12/16/18,5/29/19,,ME Dondiego,ROCKSTONE CONST. SERVICES & SUPPLY,On-going
54,Concreting of Tubi-ala Lambontong Road part. Approaching to Malomboy Bridge,Surallah,CY 2017 20% LDF,84.89%,100.00%,-15.11%," 8,494,519.47 ",160,1/2/18,6/10/18,,ME Dondiego,HEXAMINDZ CORPORATION,On-going; project expired as of June 10
55,Construction of Dog Impounding facility Ecological Park,Surallah,CY 2018 Cont. Appro GF # 316,55.05%,95.30%,-40.25%," 1,791,047.18 ",90,8/15/18,12/31/18,,CJ HICBAN,FH GOPITEO CONST. & SUPPLY,On-going; variation order is on process
56,Installation of Lined Canal along Crossing Verayo - Lambontong Rd,Surallah,CY 2018 20% LDF 4.6.1,92.19%,95.53%,-3.34%," 2,632,134.06 ",130,8/21/18,12/28/18,,CJ HICBAN,DAVAO SANTHONY BUILDERS CORP.,On-going
57,"Construction of Multipurpose Building, Brgy. Lamian",Surallah,CY 2018 20% LDF ,0.00%,0.72%,-0.72%," 3,193,878.49 ",120,12/20/18,4/18/19,,ME Dondiego,FH GOPITEO CONST. & SUPPLY,On-going
58,Rehabilitation of Lamdalag - Lamcade - Klubi Rd,Lake Sebu,2018 Cont. Appro GF#318,65.32%,82.19%,-16.87%," 7,153,222.57 ",125,8/15/18,1/24/19,,A SOBREVEGA,THREE G BUILDERS,On-going
59,Rehabilitation of Lamdalag - Lamcade - Klubi Rd (Phase II),Lake Sebu,2018-20% LDF,0.12%,3.45%,-3.33%," 9,993,373.52 ",150,11/14/18,4/12/19,,A SOBREVEGA,THREE G BUILDERS,On-going
60,"Construction of Stage, Brgy. Luhib",Lake Sebu,2018-20% LDF,3.00%,26.68%,-23.68%," 997,312.62 ",90,11/27/18,2/24/19,,A SOBREVEGA,THREE G BUILDERS,On-going
61,Upgrading of Brgy. Poblacion-Matapol Road,Norala,2018-20% LDF,1.45%,0.76%,0.69%," 9,976,002.83 ",150,12/20/18,5/18/19,,A SOBREVEGA,GABRIELLAS ENTERPRISES,On-going
62,"Construciton of Stage, Brgy. Lahit",Lake Sebu,2018-20% LDF,0.00%,,," 992,314.81 ",90,12/10/18,3/9/19,,A SOBREVEGA,THREE G BUILDERS,On-going; no construction activities were done due to foundation anniversary of the barangay
63,"Const. of Bridge @ New Dumangas, T'boli-Sitio Roxas",T'boli,CY 2016 CONT. APPROP.,60.90%,95.08%,-34.18%," 24,961,302.94 ",340,6/25/17,7/9/18,,ME Dondiego,FREDEN CONSTRUCTION,"Project suspended as of July 9, 2018"
64,Conc. Of Road Leading to Bakngeb underground River,T'boli,CY 2017 20% LDF,67.45%,100.00%,-32.55%," 4,995,579.03 ",80,12/25/17,6/16/18,,MJ Dauz,JAMI CONST. & SUPPLY,On-going; major issue: no heavy equipments and insuffiecient manpower
65,"Construction of Box Culvert along Malu Creek, Sitio Bianan, Brgy. Basag",T'boli,2018 CONT. APPROP. PDRRMF #45,100.00%,100.00%,0.00%," 2,992,000.00 ",205,5/21/18,12/11/18,12/11/18,J JANUTO,FREDEN CONSTRUCTION,Completed
66,"Construction of Stage, Brgy. Datal D'lanag",T'boli,CY 2018 20% LDF,1.37%,19.27%,-17.90%," 992,963.44 ",90,11/21/18,2/18/19,,MJ Dauz,NIRVANA CONST. & SUPPLIES,On-going
67,Construction of One (1) Unit Warehouse and Drier,Surallah & T'boli,PRDP,9.00%,3.32%,5.68%," 2,996,169.76 ",90,11/3/18,3/7/19,,MJ Dauz,ROCKSTONE CONST. SERVICES & SUPPLY,On-going
68,Completion of Sports Learning Center @ Aflek NHS,T'boli,SEF SB#1-999-CONST. OF SCHOOL BLDG. & OTHER FACILITIES,1.99%,1.99%,0.00%," 995,000.00 ",90,12/23/18,3/22/19,,J JANUTO,FREDEN CONSTRUCTION,On-going
,CMGP,,,,,,,,,,,,,
1,Upgrading of Jct Nhwy. Palkan-Cannery-Jct. Upper Klinan Road (2018),Polomolok,CMGP CY 2018,70.29%,71.69%,-1.40%," 23,929,475.94 ",168,8/7/18,1/21/19,,J JANUTO,PASE CONSTRUCTION,On-going
2,Upgrading of Jct. Palkan-Cannery-Jct. Upper Klinan Road (2017),Polomolok,CMGP CY 2017,91.70%,100.00%,-8.30%," 65,098,979.00 ",140,10/10/17,10/28/18,,J JANUTO,RITCHIE-NATHALIE BUILDERS & GEM. MDSE,On-going
3,Upgrading of Jct Nhwy - Sulit - Bentung - Crossing Aflek Rd,Polomolok,CMGP CY 2018,100.00%,100.00%,0.00%," 15,760,000.00 ",113,8/7/18,12/27/18,12/27/18,J JANUTO,FREDEN CONSTRUCTION,Completed
4,Upgrading of Nhwy - Cebuano - Kipalbig Bdry Rd,Tupi,CMGP CY 2018,92.63%,80.06%,12.57%," 21,545,865.65 ",168,8/7/18,1/21/19,,A BARRIENTOS,HVC SAGITTARIUS COMMERCIAL & CONSTRUCTION,On-going
5,Upgrading of Tampakan-Tablu Boundary Road,Tampakan,CMGP CY 2018,65.44%,68.04%,-2.60%," 19,295,000.00 ",126,8/16/18,12/19/18,,A. Demetillo,FREDEN CONSTRUCTION,"Suspended as of Dec. 12, 2018 due to variation order"
6,Upgrading of Tampakan-Sta. Cruz-Topland Boundary Road,Tampakan,CMGP CY 2018,54.24%,67.74%,-13.50%," 22,179,490.33 ",146,8/8/18,12/31/18,,A. Demetillo,Dalanon Construction,"Suspended as of Dec. 12, 2018 due to variation order"
7,Upgrading of Jct.Nhwy. New Iloilo-Cabuling-New Lambunao Boundary Road,Tantangan,CMGP CY 2018,74.13%,77.30%,-3.17%," 33,866,533.26 ",172,8/7/18,1/25/19,,S. Rentoza,Reydan Builders,On-going
8,Upgrading of Jct. Nhwy. Poblacion - Tantangan-Tacub-Tinago Boundary Road,Tantangan,CMGP CY 2018,72.49%,22.70%,49.79%," 23,825,000.00 ",152,8/7/18,1/5/19,,S. Rentoza,FREDEN CONSTRUCTION,On-going; major issue: the layout of lined canal does not conform with the approved pland and the elevation shoud be leveled with the edge of the PCCP & not to the center line
9,Upgrading of Centrala-Naci-Lambontong Road,Surallah,CMGP CY 2018,86.72%,89.14%,-2.42%," 31,553,343.91 ",168,8/7/18,1/21/19,,ME Dondiego,FH Gopiteo Const.& Supply,On-going
,,,,,,,,,,,,,,
Prepared by:,,,,,,Submitted by:,,,,,,,Approved:,
,,,,,,,,,,,,,,
ELSA T. SOMBREA,,"CASIMERO D. PADILLA, JR.",,,,"VICENTE P. AYONGAO, MPA",,,,,,,"MARNILO S. APEROCHO, MPA",
Engineer III-Chief Upper Valley Section,,"Engineer III-Chief, Lower Valley Section",,,,Engineer IV,,,,,,,Provincial Engineer,
,,,,,,Chief Const. & Maint. Division,,,,,,,,
