Republic of the Philippines,,,,,,,,,,,,,,
Province of South Cotabato,,,,,,,,,,,,,,
OFFICE OF THE PROVINCIAL ENGINEER,,,,,,,,,,,,,,
City of Koronadal,,,,,,,,,,,,,,
,,,,,,,,,,,,,,
SUMMARY OF MONTHLY ACCOMPLISHMENT REPORTS,,,,,,,,,,,,,,
"As of July 25, 2018",,,,,,,,,,,,,,
,,,,,,,,,,,,,,
,Name of Project,Location,Source of Funds,Accomplishment,,Slippage,Contract,No. of Days,Date,Target Date,Date Completed,Project Engineer,Implementor,Remarks
,,,, % WT Actual,% WT Plan,,Amount,,Started, of Completion,,,,
1,Construction of Lined Canal Along Upper Klinan - Cannery Rd,Polomolok,CY 2017 CONST. APPROP. ,100.00%,100.00%,0.00%," 4,434,321.22 ",195,1/23/18,8/5/18,7/26/18,CJ HICBAN,"UNIFIED WORKERS CONST. & DEV'T. MPC, INC.",Completed
2,"Const. of Day Care Center Prk. Faustino, Brgy. Pob",Polomolok,2018 CONT. APPRO. GF#259,73.73%,100.00%,-26.27%," 1,192,955.89 ",75,3/27/18,6/10/18,,A. DEMETILLO,JAMI CONST. & SUPPLY,On-going
3,Construction of Sitio El Nama Bridge,Tupi,CY 2016 CONT APPROP. #182-GF,87.54%,100.00%,-12.46%," 4,904,647.08 ",220,6/12/16,1/17/17,,A. DEMETILLO,CS CONSTRUCTION & SUPPLY,On-going
4,Const. of Box Culvert @ Prk. Malipayon,Tupi,CY 2017 CONT APPROP. #24,0.00%,,," 1,935,054.16 ",90,11/5/17,2/2/18,,A. DEMETILLO,KING BUILDERS CONST. & SUPPLY,"Project suspended waiting for the approved revised plan and variation order prepared by the Planning, Programming & Designing Div. for implementation"
5,"Construction of Water System, Acmonan",Tupi,CY 2017 20% LDF,100.00%,100.00%,0.00%," 1,495,000.00 ",90,4/19/18,7/17/18,7/17/18,A DEMETILLO,FREDEN CONSTRUCTION,Completed
6,"Construction of Water System @ prk. 3 Sultan Village & Cartil, Brgy. Palian",Tupi,,0.08%,2.42%,-2.34%," 1,488,617.60 ",100,7/4/18,10/11/18,,J JANUTO,JANMARIE CONST. SERVICE & SUPPLY,On-going
7,Upgrading of Acmonan Road,Tupi,,1.80%,0.15%,1.65%," 9,968,842.72 ",135,7/23/18,12/4/18,,J JANUTO,PASE CONSTRUCTION,On-going
8,Renovation of Brgy. Hall @ Brgy. Linan,Tupi,,3.74%,7.49%,-3.75%," 988,822.23 ",60,6/28/18,8/26/18,,J JANUTO,JJHAK CONSTRUCTION,On-going
9,Conc. Of Nhwy. to Brgy. Concepcion,Koronadal City,CY 2017 20% LDF,88.85%,100.00%,-11.15%," 5,919,451.68 ",75,11/28/17,4/16/18,,CJ HICBAN,BETTER WORK CONSTRUCTION,"On-going; project expired last April 16, 2018"
10,Construction of 2nd Floor of the Student Dormitory,Koronadal City,CY 2018 Cont. APPROP. GF #211,47.40%,82.92%,-35.52%," 2,989,399.99 ",90,3/27/18,8/3/18,,CJ HICBAN,MARBEL DYNAMIC BUILDERS,On-going; time extension is on process
11,"Refurbishing & Improvement of Provincial Pre-Audit Div. Office, Finance Bldg.",Koronadal City,CY 2016 CONST. APPROP. #228-GF,58.24%,51.99%,6.25%," 1,041,997.26 ",90,11/22/16,3/15/18,,E SOLATORIO,KING BUILDERS CONST. & SUPPLY,"Suspended as of Feb. 22, 2018 due to the request for revision of the approved plan by the Provincial Accountant & Variation Order"
12,"Const. of Bukang Liwayway Bridge/Riverbank Protection, Prk. Artesian, Brgy. San Roque ",Koronadal City,CY 2016 20% LDF,77.03%,69.90%,7.13%," 15,950,503.14 ",320,12/5/16,9/4/18,,E SOLATORIO,REYDAN BUILDERS,On-going
13,Const. of Perimeter Fence-Firewall @ OPAG,Koronadal City,CY 2017 20% LDF,61.65%,29.29%,32.36%," 792,000.00 ",60,1/10/18,8/20/18,,E SOLATORIO,FREDEN CONSTRUCTION,On-going; variation order is on process
14,"Const. of 1 Unit Box Culvert Connecting Prk. Pag-asa & Prk. Blaan, Brgy. Magsaysay",Koronadal City,2017 PDRRMF-IP TF 2.4,0.00%,,," 1,263,126.92 ",50,4/16/18,6/4/18,,E SOLATORIO,KING BUILDERS CONST. & SUPPLY,"Resumed as of July 30, 2018"
15,Completion of PDRR Operations Center & Warehouse @ PEO Compound,Koronadal City,999.4-SB#2-CPDRROCW,54.10%,100.00%,-45.90%," 1,488,317.54 ",70,4/8/18,6/16/18,,E SOLATORIO,ROCKSTONE CONST. SERVICES & SUPPLY,"Suspended as of June 14, 2018 due to the new policy of SOCOTECO 1 in banking of 100kVA transformer"
16,Purchase & Installation of Elevator (Includes Architectural Design and Elevator Shaft),Koronadal City,2018 CONT. APPROP. GF #133,27.43%,37.27%,-9.84%," 9,326,531.86 ",130,5/21/18,9/30/18,,E SOLATORIO,ROYAL SUMMIT INFINITY DEV'T. CORP.,On-going
17,Upgrading of Cacub to Palo 19 Road,Koronadal-Tampakan,CY 2016CONT. APPROP. #194-GF,90.67%,100.00%,-9.33%," 9,769,932.04 ",180,7/26/16,5/21/18,,E SOLATORIO,KING BUILDERS CONST. & SUPPLY,On-going; no activities
18,"Const. of Day Care Center, Sitio El Ulit, Brgy. Bukay Pait",Tantangan,CY 2017 20% LDF,54.59%,54.07%,0.52%," 1,185,000.00 ",60,6/13/18,8/11/18,,E SOLATORIO,FREDEN CONSTRUCTION,On-going
19,"Const. of Facilities in Evacuation Centers (Const. of Comfort Room & Kitchen), San Felipe",Tantangan,CY 2018 Cont. APPROP. GF #19,100.00%,100.00%,0.00%," 1,544,000.00 ",75,3/29/18,7/16/18,7/16/18,Z TUMALA,FREDEN CONSTRUCTION,Completed
20,Rehabilitation of Albagan Road,Tampakan,,49.37%,50.64%,-1.27%," 5,986,721.47 ",100,9/26/17,2/2/18,,A BARRIENTOS,JAMI CONST. & SUPPLY,"Project suspended as of Jan. 15, 2017, due to road condition going to project site and the contractor have diffilculty in hauling of materials & due to unforseen rocky materials that is not yet removed by the contractor"
21,Const. of Albagan Gym with Stage,Tampakan,CY 2017 20% LDF,90.64%,100.00%,-9.36%," 4,033,389.66 ",200,11/28/17,6/15/18,,A BARRIENTOS,JAMI CONST. & SUPPLY,On-going
22,"Const. of Salway Box Culvert, Brgy. Tablu",Tampakan,9999-Non-Office 5% CF,16.45%,61.29%,-44.84%," 2,987,473.44 ",135,12/26/17,5/9/18,,A BARRIENTOS,MFN BUILDERS,"Project suspended as of Apr. 2, 2018, due to road condition going to project site and the contractor have diffilculty in hauling of materials"
23,"Establishment of Greenhouse for Organic Vegetables Production @ Provincial Grove, Nursery & Demo Farm, Sitio Pedregosa, Brgy. Reyes",Banga,CY 2017 20% LDF 8.7.1.2,100.00%,100.00%,0.00%," 264,308.97 ",40,9/28/17,11/6/17,7/6/18,MJ Dauz,TRIPLE Z MDSG. & ELECTRICAL SERVICES,Completed
24,"Establishment of Nursery for Organic Vegetables Production @ Provincial Grove, Nursery & Demo Farm, Sitio Pedregosa, Brgy. Reyes",Banga,CY 2017 20% LDF 8.7.1.1,100.00%,100.00%,0.00%," 288,485.65 ",40,9/28/17,11/6/17,7/6/18,MJ Dauz,TRIPLE Z MDSG. & ELECTRICAL SERVICES,Completed
25,Repair of Lined Canal & Inst. Of Drop Structure @ Sitio Lambukay,Banga,CY 2017 20% LDF,79.72%,91.04%,-11.32%," 2,205,000.00 ",120,1/2/18,8/7/18,,MJ Dauz,FREDEN CONSTRUCTION,On-going
26,Concreting of Lambingi-Lampari Road,Banga,CY 2017 20% LDF,89.18%,100.00%,-10.82%," 11,988,000.00 ",140,1/18/18,7/21/18,,MJ Dauz,FREDEN CONSTRUCTION,On-going
27,Const. of Two CL School Bldg. w/ Two Seater Attached Toilet @ Matlong E/S,Banga,2018 CONT. APPRO SEF #42,31.22%,28.67%,2.55%," 1,990,698.89 ",120,6/10/18,10/7/18,,MJ Dauz,C.A BETALAC CONST. & GEN. MDSE.,On-going
28,"Spring Dev't. & Inst. Of Level II Water System through Hydraulic Rampump, Brgy. San Vicente",Banga,CY 2017 20% LDF,3.04%,10.35%,-7.31%," 2,700,099.48 ",175,5/21/18,11/11/18,,ME Dondiego,DAVAO SANTHONY BUILDERS CORP.,On-going
29,Upgrading of Yangco-Rang-ay Road,Banga,CY 2018 20% LDF,8.74%,3.69%,5.05%," 10,985,324.48 ",125,7/4/18,11/5/18,,ME Dondiego,FH GOPITEO CONST. & SUPPLY,On-going
30,Const. of Riverbank Protection (Indigenous Materials) & Rechanelling of Waterway @ Brgy. San Miguel,Norala,SEF-212-11.1a,0.53%,3.75%,-3.22%," 2,692,684.72 ",60,11/1/16,12/30/16,,A SOBREVEGA,ROCKSTONE CONST. SERVICES & SUPPLY,"This project is still suspended as of November 23, 2016 due to water way problem & revision of plans."
31,Conc. Of Poblacion-Simsiman-Matapol Road,Norala,CY 2015 20% LDF,98.18%,100.00%,-1.82%," 11,438,082.05 ",255,7/30/17,4/10/18,,A SOBREVEGA,RN BUILDERS & GEN. MDSE.,"On-going; project expired last Apr. 10, 2018"
32,Rehabilitation of NDH Water System,Norala,CY 2017 20% LDF,1.48%,19.19%,-17.71%," 375,786.23 ",40,12/21/17,1/29/18,,A SOBREVEGA,ROCKSTONE CONST. SERVICES & SUPPLY,"Suspended as of January 19, 2018 due to revision of plan approved  original plan is not suitable suited on site."
33,Renovation of Lapuz Brgy. Hall,Norala,CY 2017 20% LDF,92.95%,100.00%,-7.05%," 1,319,000.00 ",80,12/19/17,3/8/18,,A SOBREVEGA,"ISULAN ECT CONST. & GEN. MDSE., INC.","This project was already expired last March 8, 2018; Subject for liquidated damages"
34,Rehabilitation of Puti Water System,Norala,CY 2018 CONT. APPROP. GF #,34.72%,90.11%,-55.39%," 1,962,026.71 ",120,4/8/18,8/5/18,,A SOBREVEGA,ROCKSTONE CONST. SERVICES & SUPPLY,On-going; time extension is on process
35,Conc. Of Provincial Road Lapus to Brgy. Liberty,Norala,CY 2018 CONT. APPROP. GF #75,6.80%,11.17%,-4.37%," 17,240,000.00 ",125,3/29/18,7/31/18,,A SOBREVEGA,FREDEN CONSTRUCTION,"Project suspended as of April 25, 2018 due to road right of way problem"
36,"Const. of 1CL School Bldg. w/ Attached Toilet, Upper Lamongkot E/S",Norala,CY 2018 CONT. APPROP. SEF #40,1.64%,4.52%,-2.88%," 1,390,357.74 ",90,6/11/18,9/8/18,,A SOBREVEGA,JAMI CONST. & SUPPLY,On-going
37,"Const. of 2CL Bldg. w/ Two Seater Attached Toilet, Lapuz Elementary School",Norala,2018 CONT. APPROP SEF #43,3.71%,18.23%,-14.52%," 1,990,444.60 ",120,7/4/18,10/31/18,,A SOBREVEGA,FH GOPITEO CONST. & SUPPLY,On-going
38,Construction of Bleacher @ Brgy. Dumaguil,Norala,2018 CONT. APPROP GF #256,3.37%,2.15%,1.22%," 989,929.33 ",60,7/10/18,9/7/18,,A SOBREVEGA,ROCKSTONE CONST. SERVICES & SUPPLY,On-going
39,Construction of Naci Bridge,Surallah,CY 2015 20% LDF,100.00%,100.00%,0.00%," 24,830,790.34 ",345,1/21/16,12/30/16,6/30/18,MJ Dauz,CS CONSTRUCTION & SUPPLY (formerly: CS CONSTRUCTION/COFEJOK CONST. & SUPPLY CORP.-JOINT VENTURE,Completed
40,"Const. of 2-Storey Barangay Hall, Brgy. Little Baguio",Surallah,CY 2017 20% LDF,67.30%,100.00%,-32.70%," 2,989,004.51 ",145,1/18/18,6/11/18,,ME Dondiego,NIRVANA CONST. & SUPPLIES,On-going; project expired as of June 11
41,Concreting of Tubi-ala Lambontong Road part. Approaching to Malomboy Bridge,Surallah,CY 2017 20% LDF,58.39%,100.00%,-41.61%," 8,494,519.47 ",160,1/2/18,6/10/18,,ME Dondiego,HEXAMINDZ CORPORATION,On-going; project expired as of June 10
42,Const. of Box Culvert along Tubi-ala-Lambontong Road,Surallah,2016 PDRRMF-IP,37.23%,22.22%,15.01%," 2,990,518.48 ",125,4/19/18,10/1/18,,ME Dondiego,FH GOPITEO CONST. & SUPPLY,On-going
43,Construction of Bleacher @ Brgy. Veterans,Surallah,2018 CONT. APPROP. GF #266,58.46%,70.83%,-12.37%," 993,646.47 ",60,6/11/18,8/9/18,,ME Dondiego,JAMI CONST. & SUPPLY,On-going
44,Upgrading of Provincial Road Jct. Nhwy. Brgy. Teresita,Sto. Niño,2018 20% LDF,7.78%,5.48%,2.30%," 14,990,000.00 ",135,6/28/18,11/9/18,,ME Dondiego,FREDEN CONSTRUCTION,On-going
45,Concreting of Halilan Road,Lake Sebu,CY 2017 20% LDF,92.98%,100.00%,-7.02%," 9,980,267.35 ",170,1/18/18,5/22/18,,A SOBREVEGA,ROCKSTONE CONST. SERVICES & SUPPLY,On-going; time extension #2 is on process
46,Const. of Erosion Control @ Hanoon ES,Lake Sebu,2017 Truct Fund PDRRMO,60.37%,81.25%,-20.88%," 3,992,761.71 ",90,4/10/18,8/12/18,,A SOBREVEGA,NIRVANA CONST. & SUPPLIES,On-going
47,"Const. of Bridge @ New Dumangas, T'boli-Sitio Roxas",T'boli,CY 2016 CONT. APPROP.,60.90%,95.08%,-34.18%," 24,961,302.94 ",340,6/25/17,7/9/18,,ME Dondiego,FREDEN CONSTRUCTION,"Project suspended as of July 9, 2018"
48,Conc. Of Road Leading to Bakngeb underground River,T'boli,CY 2017 20% LDF,35.92%,100.00%,-64.08%," 4,995,579.03 ",80,12/25/17,6/16/18,,MJ Dauz,JAMI CONST. & SUPPLY,On-going; major issues: 1.lack of equipments & man power; 2.Veryslow implementation of project
49,Concreting of Datal D'lanag-Tudok Road,T'boli,2018 Cont. Appropriation GF #239,35.69%,26.17%,9.52%," 19,990,000.00 ",180,4/22/18,10/18/18,,MJ Dauz,FREDEN CONSTRUCTION,On-going
50,"Construction of Box Culvert along Malu Creek, Sitio Bianan, Brgy. Basag",T'boli,2018 CONT. APPROP. PDRRMF #45,28.70%,13.26%,15.44%," 2,992,000.00 ",175,5/21/18,11/11/18,,A. DEMETILLO,FREDEN CONSTRUCTION,On-going
51,"Spring Development & Installation of Level III Water System through Hydraulic Rampump, Sitio Lamumay",T'boli,2018 CONT. APPROP. GF #308,14.15%,55.13%,-40.98%," 2,425,980.27 ",120,5/21/18,9/17/18,,MJ Dauz,DAVAO SANTHONY BUILDERS CORP.,On-going
,CMGP,,,,,,,,,,,,,
1,Upgrading of Banga-lamba-Derilon-Lampari Road,Banga/ Surallah,CMGP CY 2017,100.00%,100.00%,," 70,700,000.00 ",150,10/10/17,5/27/18,6/30/18,MJ Dauz,FREDEN CONSTRUCTION,Completed
2,Upgrading of Jct. Palkan-Cannery-Jct. Upper Klinan Road,Polomolok,CMGP CY 2017,45.34%,72.76%,-27.42%," 65,098,979.00 ",140,10/10/17,5/7/18,,A. Librado,RITCHIE-NATHALIE BUILDERS & GEM. MDSE,"Suspended as of April 25, 2018 major issues: due to frequent unfavorable weather condition the targeted elevation for proposed lined canal find difficult to prepare alignment and layout batterboard"
3,Upgrading of Maltana-Lambayong Road,Tampakan,CMGP CY 2017,100.00%,100.00%,," 49,682,481.35 ",45,10/25/17,7/27/18,7/27/18,A. Barrientos,REYDAN BUILDERS,Completed
4,Upgrading of National Highway Jct.-M.Roxas-Poblacion Sto.Niño Road,Sto. Niño,CMGP CY 2017,100.00%,99.62%,0.38%," 57,041,016.88 ",135,10/25/17,7/16/18,7/15/18,A. DEMETILLO,BETTER WORK CONSTRUCTION,Completed
5,Upgrading of NHWY Jct. Colungulo-Moloy-Duengas-Talahik Road,Surallah,CMGP CY 2017,80.11%,100.00%,-19.89%," 41,120,974.15 ",115,10/10/17,6/7/18,,ME Dondiego,BETTER WORK CONSTRUCTION,On-going
Prepared by:,,,,,,Submitted by:,,,,Recommending Approval:,,,Approved:,
,,,,,,,,,,,,,,
,,,,,,,,,,,,,,
ELSA T. SOMBREA,,"CASIMERO D. PADILLA, JR.",,,,"VICENTE P. AYONGAO, MPA",,,,GENEROSA P. CAPUNDAN,,,"MARNILO S. APEROCHO, MPA",
Engineer III-Chief Upper Valley Section,,"Engineer III-Chief, Lower Valley Section",,,,Engineer IV,,,,Assistant Provincial Engineer,,,Provincial Engineer,
,,,,,,Chief Const. & Maint. Division,,,,,,,,
