Republic of the Philippines,,,,,,,,,,,,,,
Province of South Cotabato,,,,,,,,,,,,,,
OFFICE OF THE PROVINCIAL ENGINEER,,,,,,,,,,,,,,
City of Koronadal,,,,,,,,,,,,,,
,,,,,,,,,,,,,,
SUMMARY OF MONTHLY ACCOMPLISHMENT REPORTS,,,,,,,,,,,,,,
"As of March  25, 2018",,,,,,,,,,,,,,
,,,,,,,,,,,,,,
,Name of Project,Location,Source of Funds,Accomplishment,,Slippage,Contract,No. of Days,Date,Target Date,Date Completed,Project Engineer,Implementor,Remarks
,,,, % WT Actual,% WT Plan,,Amount,,Started, of Completion,,,,
1,Const. of Day Care Center @ Brgy. Magsaysay,Polomolok,CY 2017 20% LDF,98.60%,100.00%,-1.40%," 1,192,955.89 ",60,11/1/17,1/19/18,,E SOLATORIO,JAMI CONST. & SUPPLY,On-going
2,"Const. of 2-Storey Barangay Hall, Brgy. Upper Klinan",Polomolok,CY 2017 20% LDF,90.14%,97.77%,-7.63%," 2,988,998.84 ",105,11/14/17,2/26/18,,E SOLATORIO,"UNIFIED WORKERS CONST. & DEV'T. MPC, INC.",On-going; 
3,Conc. of Jct. Nhwy. Crossing Palkan-Palkan Road,Polomolok,CY 2017 20% LDF,100.00%,100.00%,0.00%," 9,965,162.92 ",130,9/24/17,1/31/18,3/7/18,A. DEMETILLO,DUMALAG SURVEYING & ENG'G. SERVICES,Completed
4,Construction of Lined Canal Along Upper Klinan - Cannery Rd,Polomolok,CY 2017 CONST. APPROP. ,34.01%,11.42%,22.59%," 4,434,321.22 ",195,1/23/18,8/5/18,,CJ HICBAN,"UNIFIED WORKERS CONST. & DEV'T. MPC, INC.",On-going
5,"Completion of Barangay Hall, Brgy. Crossing Palkan",Polomolok,"1011-STAFF-999.26 BRGY. FACILITIES, CONST & IMPRV'T. PROG.",100.00%,100.00%,0.00%," 591,165.69 ",50,1/11/18,3/1/18,3/1/18,A. DEMETILLO,HVC SAGITTARIUS COMMERCIAL & CONST.,Completed
6,Construction of Sitio El Nama Bridge,Tupi,CY 2016 CONT APPROP. #182-GF,77.87%,100.00%,-22.13%," 4,904,647.08 ",220,6/12/16,1/17/17,,A. DEMETILLO,CS CONSTRUCTION & SUPPLY,On-going
7,Const. of Box Culvert @ Prk. Malipayon,Tupi,CY 2017 CONT APPROP. #24,0.00%,,," 1,935,054.16 ",90,11/5/17,2/2/18,,A. DEMETILLO,KING BUILDERS CONST. & SUPPLY,Project suspended due to the on-going evaluation & assessment of the proposed plan to the actual site condition by the Planning & Prog'g. Div.
8,Inst. Of Lined Canal along Jct. Nhwy.-Kablon Road,Tupi,CY 2017 20% LDF,100.00%,100.00%,0.00%," 1,272,371.40 ",90,12/19/17,3/18/18,3/18/18,A DEMETILLO,"UNIFIED WORKERS CONST. & DEV'T. MPC, INC.",Completed
9,"Const. of 2-Storey Barangay Hall, Brgy. Kablon",Tupi,CY 2017 20% LDF,40.01%,44.70%,-4.69%," 2,980,507.19 ",105,1/18/18,5/2/18,,A DEMETILLO,FREDEN CONSTRUCTION,On-going
10,"Const. of Facilites in Evacuation Centers (Const. of Comfort Room & Kitchen), Lunen ES",Tupi,CY 2017 CONT. APPROP.-CAL #34 ,88.03%,85.65%,2.38%," 1,545,000.00 ",75,1/18/18,4/2/18,,A DEMETILLO,FREDEN CONSTRUCTION,On-going
11,Const. of Stage @ Brgy. Tubeng,Tupi,CY 2017 20% LDF,89.14%,96.46%,-7.32%," 915,350.06 ",90,1/11/18,4/10/18,,A DEMETILLO,HVC SAGITTARIUS COMMERCIAL & CONST.,On-going
12,Inst. Of Lined Canal along Jct. Nhwy.-Cebuano Prov'l. Rd.,Tupi,9999-Non-Office 5% CF,93.99%,98.39%,-4.40%," 1,487,915.68 ",70,1/18/18,3/28/18,,A DEMETILLO,KING BUILDERS CONST. & SUPPLY,On-going
13,"Const. of Day Care Center, Tupi Relocation, Brgy. Pob.",Tupi,CY 2017 20% LDF,84.50%,89.09%,-4.59%," 1,192,742.58 ",60,1/4/18,3/4/18,,A DEMETILLO,HVC SAGITTARIUS COMMERCIAL & CONST.,On-going
14,Upgrading of Cacub to Palo 19 Road,Koronadal-Tampakan,CY 2016CONT. APPROP. #194-GF,58.21%,78.66%,-20.45%," 9,769,932.04 ",180,7/26/16,6/27/17,,CJ HICBAN,KING BUILDERS CONST. & SUPPLY,Suspended as of June 16 due to unpassable road condition before the beginning of project
15,Repair of SCPH Medical Records Office (Phase 1),Koronadal City,CY 2017 20% LDF,0.00%,,," 296,989.59 ",60,12/12/17,2/9/18,,E SOLATORIO,KING BUILDERS CONST. & SUPPLY,"Indorsed to SCPH March23, 2018"
16,"Refurbishing & Improvement of Provincial Pre-Audit Div. Office, Finance Bldg.",Koronadal City,CY 2016 CONST. APPROP. #228-GF,58.24%,51.99%,6.25%," 1,041,997.26 ",90,11/22/16,2/19/17,,E SOLATORIO,KING BUILDERS CONST. & SUPPLY,On-going
17,"Const. of Bukang Liwayway Bridge/Riverbank Protection, Prk. Artesian, Brgy. San Roque ",Koronadal City,CY 2016 20% LDF,31.93%,34.18%,-2.25%," 15,950,503.14 ",320,12/5/16,12/23/17,,E SOLATORIO,REYDAN BUILDERS,"Suspended as of September 13, 2017 due to new waterway (under negotiation)"
18,Const. of Box Culvert @ Brgy. Saravia,Koronadal City,9999-Non-Office 5% CF,82.21%,96.33%,-14.12%," 2,939,820.87 ",125,11/30/17,4/3/18,,E SOLATORIO,HVC SAGITTARIUS COMMERCIAL & CONST.,On-going
19,Const. of Water System @ PEO Compound,Koronadal City,PEO 8751-SB#1,85.30%,100.00%,-14.70%," 1,916,254.64 ",100,11/5/17,2/11/18,,E SOLATORIO,TRIPLE Z MDSG. & ELECTRICAL SERVICES,On-going; 
20,Replacement of SCGCC Roofing @ South Cotabato Gymnasium @ Cultural Center,Koronadal City,1011-SCGCC-SB#1,81.75%,100.00%,-18.25%," 5,974,714.75 ",90,11/8/17,2/5/18,,E SOLATORIO,TRIPLE Z MDSG. & ELECTRICAL SERVICES,On-going; 
21,"Furniture & Fixtures Fabrication of Deck-Type Beds for Female Inmates, South Cotabato Detention & Rehab. Center",Koronadal City,1012-SCRDC-1-07-07-010-SB#1,95.04%,84.73%,10.31%," 993,495.69 ",45,1/10/18,2/23/18,,E SOLATORIO,PASE CONSTRUCTION,"Febr. 16, 2018, suspension is on process due to type beds been assembled inside the female inmates building but the bldg was still on going construction."
22,Fabrication & Inst. Of Rice Steamer,Koronadal City,1012-SCRDC-1-07-04-990,100.00%,75.80%,24.20%," 886,672.15 ",60,1/11/18,3/11/18,2/28/18,E SOLATORIO,FH GOPITEO CONST. & SUPPLY,Completed
23,Improvement of Electrical Facilities & Provision of power House @ Finance Bldg.,Koronadal City,1011-STAFF-999.32-IMPROV'T. OF BLDG. & ELECTRICAL FACILITIES,21.47%,53.45%,-31.98%," 5,429,158.31 ",90,1/22/18,4/21/18,,E SOLATORIO,ROCKSTONE CONST. SERVICES & SUPPLY,On-going
24,Const. of Perimeter Fence-Firewall @ OPAG,Koronadal City,CY 2017 20% LDF,0.00%,0.00%,," 792,000.00 ",60,1/10/18,3/10/18,,E SOLATORIO,FREDEN CONSTRUCTION,"PROJECT SUSPENDED AS OF JANUARY 10, 2018 DUE TO AIR & NOISE POLLUTION AT THE MATERNITY LYING-IN DURING DEMOLITION WORKS."
25,"Const. of SCRDC Addt'l. Bldg. for Female Inmates, Brgy. GPS",Koronadal City,CY 2017 CONT. APPROP. ,90.80%,100.00%,-9.20%," 3,994,980.50 ",165,7/16/17,12/27/17,,CJ HICBAN,FREDEN CONSTRUCTION,"On-going; No activity since March 10 to 26, 2018"
26,Conc. Of Nhwy. to Brgy. Concepcion,Koronadal City,CY 2017 20% LDF,69.94%,100.00%,-30.06%," 5,919,451.68 ",75,11/28/17,2/10/18,,CJ HICBAN,BETTER WORK CONSTRUCTION,"On-going;Contract expires last March 17, 2018"
27,Conc. Of San Jose-Columbio Brgy. Road,Koronadal City,CY 2017 CONST. APPROP. #198-GF,87.44%,58.74%,28.70%," 4,993,000.00 ",80,11/30/17,2/18/18,,CJ HICBAN,FREDEN CONSTRUCTION,On-going
28,"Const. of Materials Testing Quality Control Div. Bldg., PEO Compound",Koronadal City,PEO 8751-SB#1-P/P-999.2-CMTQCDB,67.09%,86.03%,-18.94%," 1,690,372.86 ",70,1/18/18,3/28/18,,Z TUMALA,MEGALINE BUILDERS & SUPPLY,"Suspeded as of march 20,2018 due to variation no.1"
29,Const. of Senior Citizen Bldg. @ New Lambunao,Tantangan,CY 2017 20% LDF,100.00%,100.00%,0.00%," 1,491,447.02 ",90,1/11/18,4/17/18,3/23/18,Z TUMALA,C.A BETALAC CONST. & GEN. MDSE.,Completed
30,Concreting of Jct. Nhwy. New Ilo-ilo-Libas Road,Tantangan,CY 2017 20% LDF,97.60%,99.14%,-1.54%," 14,928,976.74 ",150,9/14/17,3/27/18,,A BARRIENTOS,FREDEN CONSTRUCTION,On-going
31,"Fencing of APP Center @ PVET, Brgy. Tinongcop",Tantangan,CY 2017 20% LDF,56.31%,66.30%,-9.99%," 4,994,185.24 ",90,12/20/17,3/19/18,,A BARRIENTOS,FH GOPITEO CONST. & SUPPLY,Suspended due to relocation of boundaries
32,Rehabilitation of Albagan Road,Tampakan,,49.37%,50.64%,-1.27%," 5,986,721.47 ",100,9/26/17,2/2/18,,A BARRIENTOS,JAMI CONST. & SUPPLY,"Project suspended as of Jan. 15, 2017, due to unpassable road before project site."
33,Const. of Albagan Gym with Stage,Tampakan,CY 2017 20% LDF,62.09%,75.19%,-13.10%," 4,033,389.66 ",140,11/28/17,4/16/18,,A BARRIENTOS,JAMI CONST. & SUPPLY,On-going; Time extension is on process.
34,"Const. of Salway Box Culvert, Brgy. Tablu",Tampakan,9999-Non-Office 5% CF,16.17%,29.56%,-13.39%," 2,987,473.44 ",90,12/26/17,3/25/18,,A BARRIENTOS,MFN BUILDERS,On-going; Time extension is on process.
35,"Const. of Day Care Center, Brgy. Poblacion",Tampakan,CY 2017 20% LDF,64.01%,100.00%,-35.99%," 1,190,000.00 ",60,12/19/17,2/16/18,,A BARRIENTOS,"ISULAN ECT CONST. & GEN. MDSE., INC.",On-going
36,"Improvement of Facilities @ Provincial Scion Grove, Nursery & Demo Farm: Const. of 800m Perimeter",Banga,CY 2017 20% LDF,95.75%,100.00%,-4.25%," 4,935,544.56 ",150,8/29/17,1/25/18,,MJ Dauz,TRIPLE Z MDSG. & ELECTRICAL SERVICES,On-going
37,"Establishment of Greenhouse for Organic Vegetables Production @ Provincial Grove, Nursery & Demo Farm, Sitio Pedregosa, Brgy. Reyes",Banga,CY 2017 20% LDF 8.7.1.2,77.05%,100.00%,-22.95%," 264,308.97 ",40,9/28/17,11/6/17,,MJ Dauz,TRIPLE Z MDSG. & ELECTRICAL SERVICES,On-going
38,"Establishment of Nursery for Organic Vegetables Production @ Provincial Grove, Nursery & Demo Farm, Sitio Pedregosa, Brgy. Reyes",Banga,CY 2017 20% LDF 8.7.1.1,75.58%,100.00%,-24.42%," 288,485.65 ",40,9/28/17,11/6/17,,MJ Dauz,TRIPLE Z MDSG. & ELECTRICAL SERVICES,On-going
39,Inst. Of Lined Canal along Rang-ay-Lamba Road,Banga,CY 2017 20% LDF,56.89%,65.57%,-8.68%," 1,515,778.02 ",70,9/24/17,4/21/18,,MJ Dauz,DAVAO SANTHONY BUILDERS CORP.,On going
40,"Renovation-Repair of Training Center @ Provincial Scion Grove, Nursery & Demo Farm",Banga,CY 2017 20% LDF,82.98%,100.00%,-17.02%," 1,761,935.91 ",100,11/5/17,2/12/18,,MJ Dauz,TRIPLE Z MDSG. & ELECTRICAL SERVICES,On-going
41,Repair of Lined Canal & Inst. Of Drop Structure @ Sitio Lambukay,Banga,CY 2017 20% LDF,0.00%,11.20%,-11.20%," 2,205,000.00 ",120,1/2/18,5/1/18,,MJ Dauz,FREDEN CONSTRUCTION,Project suspended due to quarry negotiations
42,Concreting of Lambingi-Lampari Road,Banga,CY 2017 20% LDF,3.34%,15.45%,-12.11%," 11,988,000.00 ",140,1/18/18,6/6/18,,MJ Dauz,FREDEN CONSTRUCTION,On-going
43,Const. of Riverbank Protection (Indigenous Materials) & Rechanelling of Waterway @ Brgy. San Miguel,Norala,SEF-212-11.1a,0.53%,3.75%,-3.22%," 2,692,684.72 ",60,11/1/16,12/30/16,,A SOBREVEGA,ROCKSTONE CONST. SERVICES & SUPPLY,"This project is still suspended as of November 23, 2016 due to water way problem & revision of plans."
44,Conc. Of Poblacion-Simsiman-Matapol Road,Norala,CY 2015 20% LDF,80.22%,100.00%,-19.78%," 11,438,082.05 ",230,7/30/17,3/16/18,,A SOBREVEGA,RN BUILDERS & GEN. MDSE.,Variation order & Time extension is on process
45,Conc. Of Jct. Lopez Jaena-Puti Road,Norala,CY 2017 20% LDF,70.74%,78.21%,-7.47%," 14,992,780.22 ",125,11/8/17,3/12/18,,A SOBREVEGA,RN BUILDERS & GEN. MDSE.,On-going
46,"Completion of Senior Citizen Bldg., Brgy. Kibid",Norala,CY 2017 20% LDF,100.00%,100.00%,0.00%," 134,826.72 ",18,1/22/18,2/8/18,3/5/18,A SOBREVEGA,ROCKSTONE CONST. SERVICES & SUPPLY,Completed
47,Rehabilitation of NDH Water System,Norala,CY 2017 20% LDF,1.48%,19.19%,-17.71%," 375,786.23 ",40,12/21/17,1/29/18,,A SOBREVEGA,ROCKSTONE CONST. SERVICES & SUPPLY,"Suspended as of January 9, 2018 due to revision of plan approved  original plan is not suitable on site."
48,Renovation of Lapuz Brgy. Hall,Norala,CY 2017 20% LDF,73.76%,100.00%,-26.24%," 1,319,000.00 ",60,12/19/17,2/16/18,,A SOBREVEGA,"ISULAN ECT CONST. & GEN. MDSE., INC.","This project was already expired last March 9, 2018; Subject for liquidated damages"
49,Const. of Guardrail along Jct. Nhwy.-Guinsang-an Provincial Road (Sitio Sta. Cruz),Sto. Niño,CY 2017 20% LDF,100.00%,100.00%,0.00%," 1,370,930.04 ",60,12/20/17,2/17/18,3/9/18,ME Dondiego,FH GOPITEO CONST. & SUPPLY,Completed
50,"Const. of Stage & Bleacher, Brgy. Plaza, Sajaneba",Sto. Niño,CY 2017 20% LDF,68.01%,29.82%,38.19%," 1,994,000.00 ",120,1/18/18,5/17/18,,ME Dondiego,FREDEN CONSTRUCTION,On-going
51,"Completion of Liga Hall, Municipal hall Cmpd., Pob.",Sto. Niño,CY 2017 20% LDF,100.00%,100.00%,0.00%," 991,000.00 ",75,1/10/18,3/25/18,,K SERVAÑEZ,FREDEN CONSTRUCTION,Completed
52,Construction of Naci Bridge,Surallah,CY 2015 20% LDF,95.75%,100.00%,-4.25%," 24,830,790.34 ",345,1/21/16,12/30/16,,MJ Dauz,CS CONSTRUCTION & SUPPLY (formerly: CS CONSTRUCTION/COFEJOK CONST. & SUPPLY CORP.-JOINT VENTURE,On-going; the contractor has committed to finish the project despite the liquidated damages incurred
53,Conc. Of Modon-Upper Sepaka Road,Surallah,CY 2017 20% LDF,87.99%,89.57%,-1.58%," 9,970,794.40 ",110,11/8/17,2/25/18,,ME Dondiego,MFN BUILDERS,On-going
54,"Const. of 2-Storey Barangay Hall, Brgy. Little Baguio",Surallah,CY 2017 20% LDF,29.36%,39.89%,-10.53%," 2,989,004.51 ",105,1/18/18,5/2/18,,ME Dondiego,NIRVANA CONST. & SUPPLIES,On-going
55,Concreting of Tubi-ala Lambontong Road part. Approaching to Malomboy Bridge,Surallah,CY 2017 20% LDF,14.50%,31.66%,-17.16%," 8,494,519.47 ",125,1/2/18,5/6/18,,ME Dondiego,HEXAMINDS CORPORATION,On-going
56,Consreting of Halilan Road,Lake Sebu,CY 2017 20% LDF,30.59%,50.44%,-19.85%," 9,980,267.35 ",125,1/18/18,5/22/18,,A SOBREVEGA,ROCKSTONE CONST. SERVICES & SUPPLY,On-going
57,Construction of Stage. Brgy. Bacdulong,Lake Sebu,CY 2016 PDRMMF-IP,67.78%,77.79%,-10.01%," 911,110.26 ",90,1/11/18,4/10/18,,A SOBREVEGA,KING BUILDERS CONST. & SUPPLY,On-going
58,"Completion Brgy. Hall, Brgy. Seloton",Lake Sebu,CY 2016 PDRMMF-IP,100.00%,100.00%,0.00%," 593,841.73 ",50,1/11/18,3/1/18,3/1/18,A SOBREVEGA,KGD BUILDERS,Completed
59,Conc. Of New Dumangas Road (Leading to Ressetlement Area),T'boli,CY 2017 20% LDF,70.47%,70.72%,-0.25%," 4,992,486.84 ",85,11/9/17,2/1/18,,MJ Dauz,ROCKSTONE CONST. SERVICES & SUPPLY,On-going
60,"Const. of Bridge @ New Dumangas, T'boli-Sitio Roxas",T'boli,CY 2016 CONT. APPROP.,51.29%,34.19%,17.10%," 24,961,302.94 ",265,6/25/17,3/16/18,,ME Dondiego,FREDEN CONSTRUCTION,On-going
61,Conc. Of Road Leading to Bakngeb underground River,T'boli,CY 2017 20% LDF,16.05%,32.34%,-16.29%," 4,995,579.03 ",80,12/25/17,3/14/18,,MJ Dauz,JAMI CONST. & SUPPLY,On-going
62,Repair of Classroom of Billeting Quarters for SRAA CY 2018 - Cluster I,"Banga, Surallah",CY 2017 20% SEF,100.00%,100.00%,0.00%," 2,316,996.80 ",25,2/6/18,3/2/18,3/2/18,K SERVAÑEZ,C.A BETALAC CONST. & GEN. MDSE.,Completed
63,Repair of Classroom of Billeting Quarters for SRAA CY 2018 - Cluster II,"Tampakan, Tantangan",CY 2017 20% SEF,100.00%,100.00%,0.00%," 1,234,885.74 ",25,2/8/18,3/4/18,3/4/18,Z TUMALA,MFN BUILDERS,Completed
64,Renovation/Construction of Datal D'lanag BHS,T'boli,CY 2017 20% SEF,100.00%,100.00%,0.00%," 220,027.50 ",20,3/6/18,3/25/18,3/25/18,MJ DAUZ,JAMI CONST. & SUPPLY,Completed
65,"Labor for the Installation of Pumping Station & Irrigation System Provincial Scion Grove, Nursery, Research & Demonstration Farm",Banga,2018 Cont. Appropriation GF #48,50.00%,50.00%,0.00%," 36,000.00 ",30,3/19/18,4/17/18,,MJ DAUZ,ROMEO TERCINP,On-going
,,,,,,,,,,,,,,
Prepared by:,,,,,,Submitted by:,,,,Recommending Approval:,,,Approved:,
,,,,,,,,,,,,,,
,,,,,,,,,,,,,,
ELSA T. SOMBREA,,JOSEPHINE V. JANUTO,,,,"CASIMERO D. PADILLA, JR.",,,,GENEROSA P. CAPUNDAN,,,"VICENTE P. AYONGAO, MPA",
Engineer III-Chief Upper Valley Section,,"Engineer II-OIC Chief, Lower Valley Section",,,,Engineer III-OIC,,,,Assistant Provincial Engineer,,,"Engineer IV-OIC, Provincial Engineer",
,,,,,,Chief Const. & Maint. Division,,,,,,,,
